{
  "schema_version": 1,
  "skeleton": "pb15-v1",
  "joints": [
    "head",
    "neck",
    "l_shoulder",
    "r_shoulder",
    "l_elbow",
    "r_elbow",
    "l_wrist",
    "r_wrist",
    "spine_mid",
    "l_hip",
    "r_hip",
    "l_knee",
    "r_knee",
    "l_ankle",
    "r_ankle"
  ],
  "motions": {}
}
